Title,Time,Description,Source
How the NSE turned a bad year for India’s stock market into a great one for itself,"Wed, 24 May 2023 00:04:30 GMT","Register or LoginFor an entity that is a near-monopoly, the National Stock Exchange of India’s (NSE) financials don’t attract much attention.
That’s because, unlike rival BSE (formerly the Bombay Stock Exchange), the NSE is privately held.
Even so, the NSE’s financials attest to its ever-growing dominance dominance The Ken How India’s National Stock Exchange turned from solution to problem Read more and its ability to withstand the vicissitudes of capital markets.
Anyone wanting to own NSE shares must wait two to four months, as the stock exchange goes through the process of approving each shareholder.
The BSE, long used to playing second fiddle to the NSE, is once again trying to chip away at the latter’s dominance.",https://news.google.com/rss/articles/CBMibGh0dHBzOi8vdGhlLWtlbi5jb20vc3RvcnkvaG93LXRoZS1uc2UtdHVybmVkLWEtYmFkLXllYXItZm9yLWluZGlhcy1zdG9jay1tYXJrZXQtaW50by1hLWdyZWF0LW9uZS1mb3ItaXRzZWxmL9IBAA?oc=5
Gravita India shares gains on capacity expansion of Chittoor plant,"Fri, 26 May 2023 08:58:23 GMT","Gravita Indialive bse livense live Volume Todays L/H More ×Gravita India share price gained 2 percent on May 26 after it the company said that it had expanded the capacity of its recycling unit in Andhra Pradesh's Chittoor.
The existing capacity of the unit for battery recycling has been increased by 26,440 MTPA, taking the total capacity to 64,640 MTPA, the compnay told exchanges.
With this, the expansion total capacity of Gravita Group has reached 2.78 lakh MTPA, which is in line with the company’s target of 4.25 lakh MTPA by FY26.
Catch up on all LIVE stock market updates hereThe investment in the said capacity expansion is around Rs 21 crore which has been funded through internal accruals, Gravita India said in its filing to exchanges.
The stock was trading at Rs 563 on the NSE, up 2.24 percent with a volume of 1.44 lakh shares.",https://news.google.com/rss/articles/CBMif2h0dHBzOi8vd3d3Lm1vbmV5Y29udHJvbC5jb20vbmV3cy9idXNpbmVzcy9ncmF2aXRhLWluZGlhLXNoYXJlcy1nYWluLTItYWZ0ZXItY2FwYWNpdHktZXhwYW5zaW9uLW9mLWNoaXR0b29yLXBsYW50LTEwNjY5MTYxLmh0bWzSAYMBaHR0cHM6Ly93d3cubW9uZXljb250cm9sLmNvbS9uZXdzL2J1c2luZXNzL2dyYXZpdGEtaW5kaWEtc2hhcmVzLWdhaW4tMi1hZnRlci1jYXBhY2l0eS1leHBhbnNpb24tb2YtY2hpdHRvb3ItcGxhbnQtMTA2NjkxNjEuaHRtbC9hbXA?oc=5
Why Indian stock market has been rising for last six sessions — explained,"Sat, 29 Apr 2023 07:00:00 GMT","Indian stock market closed higher on all five sessions in the week gone by.
In last five sessions, Nifty Bank index shot up 791 points or 1.87 per cent and closed at 43,233 levels breaching the previous swing high of 43,200 levels.
US dollar holds keySpeaking on the reason for rising Indian stock market, Anuj Gupta, Vice President — Research at IIFL Securities said, ""Due to weakness in the US dollar, FIIs have been fishing out money from the currency market and pumping in Indian equities.
Sensex vs Nifty vs Bank NiftyOn why Sensex and Nifty outperformed Nifty Bank in the week gone by, Anuj Gupta said, ""Bank Nifty was the first among all key benchmark indices that breached its previous swing high of 42,820.
On sectors that may fuel Indian stock market rally next week, Ravi Singhal, CEO at GCL Broking said, ""Banking, auto and capital goods segment is expected to outperform other segments as domestic demand is going to hold key for Indian stock market in near to medium term.""",https://news.google.com/rss/articles/CBMijQFodHRwczovL3d3dy5saXZlbWludC5jb20vbWFya2V0L3N0b2NrLW1hcmtldC1uZXdzL3doeS1pbmRpYW4tc3RvY2stbWFya2V0LWhhcy1iZWVuLXJpc2luZy1mb3ItbGFzdC1zaXgtc2Vzc2lvbnMtZXhwbGFpbmVkLTExNjgyNzQyODg3MzQ1Lmh0bWzSAZEBaHR0cHM6Ly93d3cubGl2ZW1pbnQuY29tL21hcmtldC9zdG9jay1tYXJrZXQtbmV3cy93aHktaW5kaWFuLXN0b2NrLW1hcmtldC1oYXMtYmVlbi1yaXNpbmctZm9yLWxhc3Qtc2l4LXNlc3Npb25zLWV4cGxhaW5lZC9hbXAtMTE2ODI3NDI4ODczNDUuaHRtbA?oc=5
3 Nifty stocks to trade ex-dividend this week. Do you own any?,"Sun, 28 May 2023 05:06:00 GMT","Shares of three Nity stocks, State Bank of India ITC , and Infosys , will trade ex-dividend this week.ITC's Board has recommended a final dividend of Rs 6.75 and a special dividend of Rs 2.75 per equity share.
ITC will trade ex-dividend on May 30.Shares of companies trade ex-dividend on the day of record date or a day before.
When a company goes ex-dividend on a particular date, its stock does not carry the value of the next dividend payment.
The date of payment is fixed on June 14.The lender fixed May 31 as the record date for the said dividend payment and will trade ex-dividend on the same date.
SBI will trade ex-dividend on May 31.Meanwhile, IT services company Infosys has announced to pay a final dividend of Rs 17.50 per equity share for the financial year ended March 31.",https://news.google.com/rss/articles/CBMijwFodHRwczovL2Vjb25vbWljdGltZXMuaW5kaWF0aW1lcy5jb20vbWFya2V0cy9zdG9ja3MvbmV3cy8zLW5pZnR5LXN0b2Nrcy10by10cmFkZS1leC1kaXZpZGVuZC10aGlzLXdlZWstZG8teW91LW93bi1hbnkvYXJ0aWNsZXNob3cvMTAwNTYzNDA3LmNtc9IBigFodHRwczovL20uZWNvbm9taWN0aW1lcy5jb20vbWFya2V0cy9zdG9ja3MvbmV3cy8zLW5pZnR5LXN0b2Nrcy10by10cmFkZS1leC1kaXZpZGVuZC10aGlzLXdlZWstZG8teW91LW93bi1hbnkvYW1wX2FydGljbGVzaG93LzEwMDU2MzQwNy5jbXM?oc=5
Looking to invest in stocks? Here are 5 attractive options,"Thu, 25 May 2023 07:29:56 GMT","Here are five stocks that have the potential to offer strong returns:ITCITC shares have been on a roll this year.
Tata MotorsTata Motors has seen a strong rally for over a month, following strong Q4 results.
Divi’s LaboratoriesPharmaceutical company Divi’s Laboratories has been witnessing a strong rally on the domestic stock markets over the past few days.
The strong rally in its share price came after the company reported a consolidated net profit rose marginally on a sequential basis.
Considering the strong rally over the past few days, Divi’s could prove to be a good bet for investors looking for short-term options.",https://news.google.com/rss/articles/CBMib2h0dHBzOi8vd3d3LmluZGlhdG9kYXkuaW4vYnVzaW5lc3Mvc3RvcnkvNS1zdG9jay1pbnZlc3RtZW50LW9wdGlvbnMtc3Ryb25nLXJldHVybnMtcG90ZW50aWFsLTIzODQwOTAtMjAyMy0wNS0yNdIBc2h0dHBzOi8vd3d3LmluZGlhdG9kYXkuaW4vYW1wL2J1c2luZXNzL3N0b3J5LzUtc3RvY2staW52ZXN0bWVudC1vcHRpb25zLXN0cm9uZy1yZXR1cm5zLXBvdGVudGlhbC0yMzg0MDkwLTIwMjMtMDUtMjU?oc=5
"Should you buy, sell or hold Cummins India shares after engine maker's robust Q4 results","Thu, 25 May 2023 10:51:55 GMT","Cummins India shares rose on Thursday, a day after the engine maker staged a strong performance in the quarter ended March 2023.
The Cummins India stock traded on the bourses with the symbol CUMMINSIND — gained by Rs 52.3 or 3.3 per cent to end at Rs 1,646 apiece on BSE.
Despite Cummins India's strong quarterly performance, brokerages remained divided on the stock.
Nomura continued with a 'reduce' rating on the stock with a target price of Rs 1,145 apiece.
Cummins India shares: Past performanceCummins India shares have grown almost 57 per cent in value in the past one year, far better than a 14 per cent rise in the headline Nifty index.",https://news.google.com/rss/articles/CBMirAFodHRwczovL3d3dy56ZWViaXouY29tL21hcmtldHMvc3RvY2tzL25ld3MtY3VtbWlucy1pbmRpYS1zaGFyZS1wcmljZS1uc2UtYnNlLXRhcmdldC10b2RheS1xNC1yZXN1bHRzLTIwMjMtcHJvZml0LXJldmVudWUtbWFyZ2lucy1kaWVzZWwtYW5kLW5hdHVyYWwtZ2FzLWVuZ2luZXMtbWFrZXItMjM2OTU40gGwAWh0dHBzOi8vd3d3LnplZWJpei5jb20vbWFya2V0cy9zdG9ja3MvbmV3cy1jdW1taW5zLWluZGlhLXNoYXJlLXByaWNlLW5zZS1ic2UtdGFyZ2V0LXRvZGF5LXE0LXJlc3VsdHMtMjAyMy1wcm9maXQtcmV2ZW51ZS1tYXJnaW5zLWRpZXNlbC1hbmQtbmF0dXJhbC1nYXMtZW5naW5lcy1tYWtlci0yMzY5NTgvYW1w?oc=5
Value buys? These 20 Nifty stocks trading below 10-year PEs,"Fri, 26 May 2023 04:22:00 GMT","Out of 23 calls on the stock, 17 have strong buy ratings, 3 buy ratings, 2 hold calls and one sell call.
The stock, which declared its Q4 earnings on Wednesday, has 14 strong buy out of 20 recommendations and no sell calls.
It has an average upside scope of 30%, Trendlyne data further suggests.
Axis Bank and M&M are also below their 10-year average while they have an upside scope of over 20% each in the next 12 months.
HDFC Bank's counterpart HDFC is also trailing its 10-year average PE of 20.17 times as stock trades at 19.11 times.",https://news.google.com/rss/articles/CBMijQFodHRwczovL2Vjb25vbWljdGltZXMuaW5kaWF0aW1lcy5jb20vbWFya2V0cy9zdG9ja3MvbmV3cy92YWx1ZS1idXlzLXRoZXNlLTIwLW5pZnR5LXN0b2Nrcy10cmFkaW5nLWJlbG93LTEwLXllYXItcGVzL2FydGljbGVzaG93LzEwMDUxNzk0NS5jbXPSAYgBaHR0cHM6Ly9tLmVjb25vbWljdGltZXMuY29tL21hcmtldHMvc3RvY2tzL25ld3MvdmFsdWUtYnV5cy10aGVzZS0yMC1uaWZ0eS1zdG9ja3MtdHJhZGluZy1iZWxvdy0xMC15ZWFyLXBlcy9hbXBfYXJ0aWNsZXNob3cvMTAwNTE3OTQ1LmNtcw?oc=5
ABB India stock at new 52-week high; does this rally have more legs?,"Mon, 08 May 2023 07:00:00 GMT","Shares of ABB India Ltd hit a new 52-week high of ₹3,789.60 on the National Stock Exchange on Monday after it reported robust March quarter (Q1CY23) earnings.
ABB India follows a January to December financial year.
Revenue rose 22.5% year-on-year (YoY) in Q1CY23, driven by improved execution and favourable product mix.
Analysts said that ABB's Q1CY23 order book, valued at around ₹7,170 crore, provides revenue visibility for the next few quarters.
These factors have led some analysts to revise their earnings estimates upwards.",https://news.google.com/rss/articles/CBMihQFodHRwczovL3d3dy5saXZlbWludC5jb20vbWFya2V0L21hcmstdG8tbWFya2V0L2FiYi1pbmRpYS1zdG9jay1hdC1uZXctNTItd2Vlay1oaWdoLWRvZXMtdGhpcy1yYWxseS1oYXZlLW1vcmUtbGVncy0xMTY4MzUzNzMwMTQ1MC5odG1s0gGJAWh0dHBzOi8vd3d3LmxpdmVtaW50LmNvbS9tYXJrZXQvbWFyay10by1tYXJrZXQvYWJiLWluZGlhLXN0b2NrLWF0LW5ldy01Mi13ZWVrLWhpZ2gtZG9lcy10aGlzLXJhbGx5LWhhdmUtbW9yZS1sZWdzL2FtcC0xMTY4MzUzNzMwMTQ1MC5odG1s?oc=5
"Stock Radar: Buy Engineers India for a target of Rs 120 in next 3-4 months, says Gaurav Bissa, InCred Equities","Mon, 22 May 2023 16:30:00 GMT","""Engineers India stock has been in a strong consolidation for the last three years.
It gave a breakout from a 3-year Ascending Triangle pattern on weekly Heikin Ashi charts,"" Gaurav Bissa, VP, InCred Equities, said.",https://news.google.com/rss/articles/CBMiswFodHRwczovL20uZWNvbm9taWN0aW1lcy5jb20vbWFya2V0cy9zdG9ja3MvbmV3cy9zdG9jay1yYWRhci1idXktZW5naW5lZXJzLWluZGlhLWZvci1hLXRhcmdldC1vZi1ycy0xMjAtaW4tbmV4dC0zLTQtbW9udGhzLXNheXMtZ2F1cmF2LWJpc3NhLWluY3JlZC1lcXVpdGllcy92aWRlb3Nob3cvMTAwNDIzODU3LmNtc9IBtwFodHRwczovL20uZWNvbm9taWN0aW1lcy5jb20vbWFya2V0cy9zdG9ja3MvbmV3cy9zdG9jay1yYWRhci1idXktZW5naW5lZXJzLWluZGlhLWZvci1hLXRhcmdldC1vZi1ycy0xMjAtaW4tbmV4dC0zLTQtbW9udGhzLXNheXMtZ2F1cmF2LWJpc3NhLWluY3JlZC1lcXVpdGllcy9hbXBfdmlkZW9zaG93LzEwMDQyMzg1Ny5jbXM?oc=5
GAIL India Q4 earnings: Stock slips over 4% as net profit tumbles 77%,"Thu, 18 May 2023 07:00:00 GMT","Shares of GAIL India slipped over 4 per cent today after the state-owned gas utility reported a weak set of earnings for the quarter ended March 2023.
Standalone profit plunged 77.5 percent year-on-year to Rs 603 crore in Q4 against the net profit of Rs 2683 crore in the year-ago period.
Subsequently, GAIL India stock touched an intraday low of Rs 104.75, down 4.77% on BSE.
Earlier, GAIL India stock opened flat at Rs 110.65 today.
GAIL India shares trade higher than the 100 day and 200 day moving averages but lower than 5 day, 20 day and 50 day moving averages.",https://news.google.com/rss/articles/CBMijQFodHRwczovL3d3dy5idXNpbmVzc3RvZGF5LmluL21hcmtldHMvY29tcGFueS1zdG9jay9zdG9yeS9nYWlsLWluZGlhLXE0LWVhcm5pbmdzLXN0b2NrLXNsaXBzLW92ZXItNC1hcy1uZXQtcHJvZml0LXR1bWJsZXMtNzctMzgxODMyLTIwMjMtMDUtMTjSAZEBaHR0cHM6Ly93d3cuYnVzaW5lc3N0b2RheS5pbi9hbXAvbWFya2V0cy9jb21wYW55LXN0b2NrL3N0b3J5L2dhaWwtaW5kaWEtcTQtZWFybmluZ3Mtc3RvY2stc2xpcHMtb3Zlci00LWFzLW5ldC1wcm9maXQtdHVtYmxlcy03Ny0zODE4MzItMjAyMy0wNS0xOA?oc=5
Does the global recession impact India’s stock market?,"Sun, 14 May 2023 07:00:00 GMT","The global markets witnessed massive volatility in 2022 as Russia and Ukraine entered into a conflict, inflation reached multi-decade highs and rising concerns of global recession spooked investors.
According to the IMF, the global economy is set to grow at 2.8% for 2023 with a recession expected in the US.
Despite this slowdown in the global economy, India will continue to be amongst the fastest-growing emerging countries.
According to the RBI, India’s GDP growth is expected at 6.5% in FY24 whereas IMF expects India’s growth at 5.9% for FY24.
The rural economy has been hit hard during the pandemic and is yet to fully recover from its impact.",https://news.google.com/rss/articles/CBMicGh0dHBzOi8vd3d3LmZpbmFuY2lhbGV4cHJlc3MuY29tL21hcmtldC9jYWZlaW52ZXN0L2RvZXMtdGhlLWdsb2JhbC1yZWNlc3Npb24taW1wYWN0LWluZGlhcy1zdG9jay1tYXJrZXQvMzA4Njk3Mi_SAXVodHRwczovL3d3dy5maW5hbmNpYWxleHByZXNzLmNvbS9tYXJrZXQvY2FmZWludmVzdC9kb2VzLXRoZS1nbG9iYWwtcmVjZXNzaW9uLWltcGFjdC1pbmRpYXMtc3RvY2stbWFya2V0LzMwODY5NzIvbGl0ZS8?oc=5
"India Stock Outlook: Last Leg Of Q4 Earnings, Foreign Fund Inflow Patterns Key Triggers","Mon, 22 May 2023 02:43:12 GMT","Coming to the foreign portfolio investors, they have been net buyers in India for the third month on a trot now, helping buoy Indian stocks.
FPIs bought assets worth Rs 11,631 crore in Indian stock markets in April, according to NSDL data.
In March, they purchased assets worth about Rs 7,936 crore in Indian stock markets.
Barring some exceptions, foreign portfolio investors (FPIs) had been selling equities in the Indian markets for over a year, which started in October 2021 for various reasons.
In 2022, foreign portfolio investors sold Rs 121,439 crore worth of stocks in India on a cumulative basis.",https://news.google.com/rss/articles/CBMijQFodHRwczovL3d3dy5idXNpbmVzc3dvcmxkLmluL2FydGljbGUvSW5kaWEtU3RvY2stT3V0bG9vay1MYXN0LUxlZy1PZi1RNC1FYXJuaW5ncy1Gb3JlaWduLUZ1bmQtSW5mbG93LVBhdHRlcm5zLUtleS1UcmlnZ2Vycy0vMjItMDUtMjAyMy00NzczODHSAQA?oc=5
57 smallcap stocks offer double-digit returns in a cautious market week,"Sat, 27 May 2023 03:38:00 GMT","India’s stock market witnessed a broad-based rally Friday, helping local shares regain their positive momentum, on expectations of the US government edging closer to a deal to raise the national debt ceiling.
Deutsche Bank is also book runner and lead arranger of the capital raise along with Standard Chartered Bank (SCB).
Experience Your Economic Times Newspaper, The Digital Way!
Saturday, 27 May, 2023(What's moving Sensex and Nifty Track latest market news stock tips and expert advice on ETMarkets .
Download The Economic Times News App to get Daily Market Updates & Live Business News.",https://news.google.com/rss/articles/CBMiowFodHRwczovL2Vjb25vbWljdGltZXMuaW5kaWF0aW1lcy5jb20vbWFya2V0cy9zdG9ja3MvbmV3cy81Ny1zbWFsbGNhcC1zdG9ja3Mtc2hpbmUtdG8tb2ZmZXItZG91YmxlLWRpZ2l0LXJldHVybnMtaW4tYS1jYXV0aW91cy1tYXJrZXQtd2Vlay9hcnRpY2xlc2hvdy8xMDA1NDI0NTYuY21z0gGeAWh0dHBzOi8vbS5lY29ub21pY3RpbWVzLmNvbS9tYXJrZXRzL3N0b2Nrcy9uZXdzLzU3LXNtYWxsY2FwLXN0b2Nrcy1zaGluZS10by1vZmZlci1kb3VibGUtZGlnaXQtcmV0dXJucy1pbi1hLWNhdXRpb3VzLW1hcmtldC13ZWVrL2FtcF9hcnRpY2xlc2hvdy8xMDA1NDI0NTYuY21z?oc=5
"BSE Holidays 2023: List Of Stock Market Trading Holidays For BSE India, Sensex","Thu, 18 May 2023 07:00:00 GMT","TBSE Holidays 2023 for the Equity segmentS.NO.
Trades, business, and end-of-day data are all part of the package.On weekdays, trade-in BSE runs from 9:15 a.m. through 3:30 p.m., while Saturday and Sunday are BSE holidays.
In addition to weekends, BSE holidays also include several national holidays of cultural or religious significance.The stock exchange has put out a separate BSE holidays 2023 list based on trading sectors.
BSE trading holidays have been separated from clearing holidays as well.
On BSE trading holidays, there are no transactions on the Bombay Stock Exchange.",https://news.google.com/rss/articles/CBMiQ2h0dHBzOi8vd3d3LmZvcmJlc2luZGlhLmNvbS9hcnRpY2xlL2V4cGxhaW5lcnMvYnNlLWhvbGlkYXlzLzg1MDAxLzHSAUdodHRwczovL3d3dy5mb3JiZXNpbmRpYS5jb20vYW1wL2FydGljbGUvZXhwbGFpbmVycy9ic2UtaG9saWRheXMvODUwMDEvMQ?oc=5
Better than PE: 4 midcap stock with right PEG ratio,"Sun, 28 May 2023 04:07:00 GMT","The PE ratio is one of the most overused and misused ratios.
It is used by all and sundry to justify their valuations and create a mirage of value.
Right from investor presentations to research reports, one finds its mention everywhere.
It is better to use the PEG ratio when looking for long-term investment, though finding the right ratio is itself a challenge.
In simple terms, it makes sense to pay more",https://news.google.com/rss/articles/CBMifGh0dHBzOi8vbS5lY29ub21pY3RpbWVzLmNvbS9tYXJrZXRzL3N0b2Nrcy9uZXdzL2JldHRlci10aGFuLXBlLTQtbWlkY2FwLXN0b2NrLXdpdGgtcmlnaHQtcGVnLXJhdGlvL2FydGljbGVzaG93LzEwMDU2MjUwMS5jbXPSAYABaHR0cHM6Ly9tLmVjb25vbWljdGltZXMuY29tL21hcmtldHMvc3RvY2tzL25ld3MvYmV0dGVyLXRoYW4tcGUtNC1taWRjYXAtc3RvY2std2l0aC1yaWdodC1wZWctcmF0aW8vYW1wX2FydGljbGVzaG93LzEwMDU2MjUwMS5jbXM?oc=5
Jefferies’ Chris Wood adds Zomato to India portfolio; HDFC Life makes exit,"Fri, 26 May 2023 13:40:00 GMT","ETMarkets.comJefferies’ Global Head of Equity Strategy Christopher Wood has picked food delivery app Zomato for his India long-only portfolio.
The brokerage noted improving growth and profit outlook.We maintain ‘buy’ on Zomato with TP of Rs 90/share.
The superior Q4 performance bolsters our belief in Zomato’s ability to execute & deliver profitable growth.
Improvement in consumer sentiment is expected to drive GOV/MTU growth.Nomura maintains a 'reduce' on Zomato shares with a price target of Rs 45, implying a 30% downside.
Achieving high GOV growth and strong CM improvement in core FD business remain challenging, in our view.",https://news.google.com/rss/articles/CBMimwFodHRwczovL2Vjb25vbWljdGltZXMuaW5kaWF0aW1lcy5jb20vbWFya2V0cy9zdG9ja3MvbmV3cy9qZWZmZXJpZXMtY2hyaXMtd29vZC1hZGRzLXpvbWF0by10by1pbmRpYS1wb3J0Zm9saW8taGRmYy1saWZlLW1ha2VzLWV4aXQvYXJ0aWNsZXNob3cvMTAwNTMyNzg2LmNtc9IBlgFodHRwczovL20uZWNvbm9taWN0aW1lcy5jb20vbWFya2V0cy9zdG9ja3MvbmV3cy9qZWZmZXJpZXMtY2hyaXMtd29vZC1hZGRzLXpvbWF0by10by1pbmRpYS1wb3J0Zm9saW8taGRmYy1saWZlLW1ha2VzLWV4aXQvYW1wX2FydGljbGVzaG93LzEwMDUzMjc4Ni5jbXM?oc=5
Linde India stock spikes 4% on strong growth in Q4 profits,"Wed, 24 May 2023 04:28:01 GMT","Strong growth in revenue was visible in both gases and project engineering services.
This comes on an 18 percent growth in revenue from operations to Rs 630 crore.
Strong growth in revenue was visible in both gases and project engineering services.
Gases revenue was Rs 488.72 crore while project engineering revenue came in at Rs 189.36 crore.
Linde India said the record date for the purpose of payment of dividend to the will be Thursday, 10 August 2023.",https://news.google.com/rss/articles/CBMieWh0dHBzOi8vd3d3Lm1vbmV5Y29udHJvbC5jb20vbmV3cy9idXNpbmVzcy9zdG9ja3MvbGluZGUtaW5kaWEtc3RvY2stc3Bpa2VzLTQtb24tc3Ryb25nLWdyb3d0aC1pbi1xNC1wcm9maXRzLTEwNjQ5MDkxLmh0bWzSAX1odHRwczovL3d3dy5tb25leWNvbnRyb2wuY29tL25ld3MvYnVzaW5lc3Mvc3RvY2tzL2xpbmRlLWluZGlhLXN0b2NrLXNwaWtlcy00LW9uLXN0cm9uZy1ncm93dGgtaW4tcTQtcHJvZml0cy0xMDY0OTA5MS5odG1sL2FtcA?oc=5
"LIC, Hindalco, Brigade Enterprises, Oil India among stocks to watch out for today","Thu, 25 May 2023 03:25:37 GMT","Hindalco IndustriesHindalco Industries posted a 37 per cent drop in consolidated net profit at Rs 2,411 crore for the quarter compared with Rs 3,851 crore in the same quarter last year.
Revenue from operation jumped 33.74 per cent YoY to Rs 1,301.72 crore compared with Rs 973.32 crore in the same quarter last year.
Brigade EnterprisesBrigade Enterprises has posted net profit of Rs 69 crore in the three months ended March period.
Oil IndiaOil India logged a net profit of Rs 1,788 crore in the fourth quarter.
TridentTrident reported a net profit of Rs 130 crore, while revenue from operations came at Rs 1,573 crore.",https://news.google.com/rss/articles/CBMikgFodHRwczovL3d3dy5idXNpbmVzc3RvZGF5LmluL21hcmtldHMvc3RvY2tzL3N0b3J5L2xpYy1oaW5kYWxjby1icmlnYWRlLWVudGVycHJpc2VzLW9pbC1pbmRpYS1hbW9uZy1zdG9ja3MtdG8td2F0Y2gtb3V0LWZvci10b2RheS0zODI2OTItMjAyMy0wNS0yNdIBlgFodHRwczovL3d3dy5idXNpbmVzc3RvZGF5LmluL2FtcC9tYXJrZXRzL3N0b2Nrcy9zdG9yeS9saWMtaGluZGFsY28tYnJpZ2FkZS1lbnRlcnByaXNlcy1vaWwtaW5kaWEtYW1vbmctc3RvY2tzLXRvLXdhdGNoLW91dC1mb3ItdG9kYXktMzgyNjkyLTIwMjMtMDUtMjU?oc=5
"Stocks To Watch: LIC, Vodafone Idea, Zee, Oil India, Strides Pharma, Emami, Adani Ports, Nykaa, Wipro","Wed, 24 May 2023 23:30:00 GMT","As per Bloomberg, before Nvidia's 27% surge in after-hours trading, major Asia equity indices had looked likely to decline on Thursday, with futures lower for Hong Kong, Japan and Australia.
At 05:45 a.m., the Singapore-traded SGX Nifty, an early indicator of the Nifty 50 Index’s performance in India, down 0.19% at 18,250.
Domestic benchmark indices ended their three-day rally to close lower as the HDFC twins and Adani Enterprises Ltd. dragged.
Foreign investors were net buyers for the third straight day and bought equities worth Rs 1,185.84 crore.
On the other hand, domestic institutional investors were buyers for the fourth straight day and bought stocks worth Rs 300.93 crore, the NSE data showed.",https://news.google.com/rss/articles/CBMifGh0dHBzOi8vd3d3LmJxcHJpbWUuY29tL21hcmtldHMvc3RvY2tzLXRvLXdhdGNoLWxpYy12b2RhZm9uZS1pZGVhLXplZS1vaWwtaW5kaWEtc3RyaWRlcy1waGFybWEtZW1hbWktYWRhbmktcG9ydHMtbnlrYWEtd2lwcm_SAYABaHR0cHM6Ly93d3cuYnFwcmltZS5jb20vYW1wL21hcmtldHMvc3RvY2tzLXRvLXdhdGNoLWxpYy12b2RhZm9uZS1pZGVhLXplZS1vaWwtaW5kaWEtc3RyaWRlcy1waGFybWEtZW1hbWktYWRhbmktcG9ydHMtbnlrYWEtd2lwcm8?oc=5
2 top stock recommendations from Swati Ananda Hotkar,"Fri, 26 May 2023 08:04:00 GMT","In the full month of May, we have seen that Nifty has got stuck into the 18,000 to 18,400 level within those 400 points.
The only concern point is the Bank Nifty.
Bank Nifty still is just facing a very strong resistance level nearby 44,000 levels.
From the month of March itself the stock is trading in the upward rising channel.
So, just a little bit cautious on the HDFC Bank but positive on ICICI Bank and SBI.",https://news.google.com/rss/articles/CBMihwFodHRwczovL2Vjb25vbWljdGltZXMuaW5kaWF0aW1lcy5jb20vbWFya2V0cy9leHBlcnQtdmlldy8yLXRvcC1zdG9jay1yZWNvbW1lbmRhdGlvbnMtZnJvbS1zd2F0aS1hbmFuZGEtaG90a2FyL2FydGljbGVzaG93LzEwMDUyMzU3My5jbXPSAYIBaHR0cHM6Ly9tLmVjb25vbWljdGltZXMuY29tL21hcmtldHMvZXhwZXJ0LXZpZXcvMi10b3Atc3RvY2stcmVjb21tZW5kYXRpb25zLWZyb20tc3dhdGktYW5hbmRhLWhvdGthci9hbXBfYXJ0aWNsZXNob3cvMTAwNTIzNTczLmNtcw?oc=5
Radhakishan Damani portfolio stock: India Cements Q4 net loss zooms 818% YoY to ₹218 Cr on higher expenses,"Wed, 24 May 2023 10:10:44 GMT","The company reported a standalone net sales of ₹1,460.47 crore in March 2023 quarter up 4.92% YoY from Rs.
During Q4FY23 it recorded a net income of ₹1478.89 Cr as against ₹1396.72 Cr in Q4FY22.
India Cement reported net expenses of ₹1607.31 Cr up by 12.14% YoY from ₹1433.19 Cr in the year-ago quarter.
The company’s net loss widened to ₹218 Cr during the quarter under review down by 818.56% from Rs.
India Cements is regarded as one of the top cement companies in India and is a significant maker and supplier of cement.",https://news.google.com/rss/articles/CBMisAFodHRwczovL3d3dy5saXZlbWludC5jb20vbWFya2V0L3N0b2NrLW1hcmtldC1uZXdzL3JhZGhha2lzaGFuLWRhbWFuaS1wb3J0Zm9saW8tc3RvY2staW5kaWEtY2VtZW50cy1xNC1uZXQtbG9zcy16b29tcy04MTgteW95LXRvLXJzLTIxOC1jci1vbi1oaWdoZXItZXhwZW5zZXMtMTE2ODQ5MjI5MzcwNzIuaHRtbNIBtAFodHRwczovL3d3dy5saXZlbWludC5jb20vbWFya2V0L3N0b2NrLW1hcmtldC1uZXdzL3JhZGhha2lzaGFuLWRhbWFuaS1wb3J0Zm9saW8tc3RvY2staW5kaWEtY2VtZW50cy1xNC1uZXQtbG9zcy16b29tcy04MTgteW95LXRvLXJzLTIxOC1jci1vbi1oaWdoZXItZXhwZW5zZXMvYW1wLTExNjg0OTIyOTM3MDcyLmh0bWw?oc=5
"Monsoons best time for Indian equities, I am looking forward to this one: Dipan Mehta","Sun, 28 May 2023 03:50:00 GMT","I think monsoons are the best time for Indian equities intuitively.
It is just that I am looking forward to this monsoon , especially on the equity side.
I have told your channel before that I think monsoons are the best time for Indian equities intuitively.
One of the biggest winners of this earning season has been travel tourism.
These are great times for travel tourism companies.Another company which comes to mind is Mahindra Holidays .",https://news.google.com/rss/articles/CBMipgFodHRwczovL2Vjb25vbWljdGltZXMuaW5kaWF0aW1lcy5jb20vbWFya2V0cy9leHBlcnQtdmlldy9tb25zb29ucy1iZXN0LXRpbWUtZm9yLWluZGlhbi1lcXVpdGllcy1pLWFtLWxvb2tpbmctZm9yd2FyZC10by10aGlzLW9uZS1kaXBhbi1tZWh0YS9hcnRpY2xlc2hvdy8xMDA1NjIzODcuY21z0gGhAWh0dHBzOi8vbS5lY29ub21pY3RpbWVzLmNvbS9tYXJrZXRzL2V4cGVydC12aWV3L21vbnNvb25zLWJlc3QtdGltZS1mb3ItaW5kaWFuLWVxdWl0aWVzLWktYW0tbG9va2luZy1mb3J3YXJkLXRvLXRoaXMtb25lLWRpcGFuLW1laHRhL2FtcF9hcnRpY2xlc2hvdy8xMDA1NjIzODcuY21z?oc=5
Page Industries shares crash 15% to hit one-year low on poor Q4 show; here's what brokerages & technical analysts say,"Fri, 26 May 2023 06:18:17 GMT","Shares of Page Industries Ltd fell sharply in Friday's trade after the company posted a 59 per cent drop in quarterly profit.
The stock dived 15 per cent to hit a one-year low of Rs 34,968.60 over its previous close of Rs 41,139.50.
On the technical front, Page Industries may face resistance between Rs 37,860 and Rs 39,700 levels, analysts said.
AR Ramachandran from Tips2trades said, ""Poor Q4 FY23 results have led to a sharp fall in Page Industries.
The stock has strong resistance at Rs 37,860.""",https://news.google.com/rss/articles/CBMiuwFodHRwczovL3d3dy5idXNpbmVzc3RvZGF5LmluL21hcmtldHMvY29tcGFueS1zdG9jay9zdG9yeS9wYWdlLWluZHVzdHJpZXMtc2hhcmVzLWNyYXNoLTE1LXRvLWhpdC1vbmUteWVhci1sb3ctb24tcG9vci1xNC1zaG93LWhlcmVzLXdoYXQtYnJva2VyYWdlcy10ZWNobmljYWwtYW5hbHlzdHMtc2F5LTM4MjkzMi0yMDIzLTA1LTI20gG_AWh0dHBzOi8vd3d3LmJ1c2luZXNzdG9kYXkuaW4vYW1wL21hcmtldHMvY29tcGFueS1zdG9jay9zdG9yeS9wYWdlLWluZHVzdHJpZXMtc2hhcmVzLWNyYXNoLTE1LXRvLWhpdC1vbmUteWVhci1sb3ctb24tcG9vci1xNC1zaG93LWhlcmVzLXdoYXQtYnJva2VyYWdlcy10ZWNobmljYWwtYW5hbHlzdHMtc2F5LTM4MjkzMi0yMDIzLTA1LTI2?oc=5
