Title,Time,Description,Source
India’s stock market makeover | World Business Watch | Latest World News | English News | WION,"Mon, 22 May 2023 06:08:09 GMT",,https://news.google.com/rss/articles/CBMiK2h0dHBzOi8vd3d3LnlvdXR1YmUuY29tL3dhdGNoP3Y9d3lfbXZoMk5LRzTSAQA?oc=5
Siemens India's unit sale to parent against the interest of minority investors: Analysts,"Wed, 24 May 2023 00:16:00 GMT","Mumbai: At least four brokerages including Nomura Jefferies , Haitong and IDBI Capital have raised concerns over Siemens India's move to sell its gear motor business to its parent.
""""What is concerning is that the business has been transferred to the parent entity at 16.7x FY22 EPS when the entire Indian entity trades at 86x FY22 earnings,"" IDBI Capital said in its report.
""This bodes negatively for minority shareholders in India on account of the unfavourable valuation at which the divestment has been done.
Basis their view, the board decided to take the higher end of their recommended valuation.
The brokerage said the unit accounted for 7% of Siemens India's FY22 sales and 9% of its profits.Nomura on Tuesday downgraded the stock and cut the target price to ₹3,521 citing weak motors growth outlook and governance concerns.",https://news.google.com/rss/articles/CBMiqQFodHRwczovL2Vjb25vbWljdGltZXMuaW5kaWF0aW1lcy5jb20vbWFya2V0cy9zdG9ja3MvbmV3cy9zaWVtZW5zLWluZGlhcy11bml0LXNhbGUtdG8tcGFyZW50LWFnYWluc3QtdGhlLWludGVyZXN0LW9mLW1pbm9yaXR5LWludmVzdG9ycy1hbmFseXN0cy9hcnRpY2xlc2hvdy8xMDA0NTkzOTMuY21z0gGkAWh0dHBzOi8vbS5lY29ub21pY3RpbWVzLmNvbS9tYXJrZXRzL3N0b2Nrcy9uZXdzL3NpZW1lbnMtaW5kaWFzLXVuaXQtc2FsZS10by1wYXJlbnQtYWdhaW5zdC10aGUtaW50ZXJlc3Qtb2YtbWlub3JpdHktaW52ZXN0b3JzLWFuYWx5c3RzL2FtcF9hcnRpY2xlc2hvdy8xMDA0NTkzOTMuY21z?oc=5
Stock Radar: Over 30% rally in 2023! This capital goods stock hit fresh record highs in May; time to buy?,"Fri, 05 May 2023 07:00:00 GMT","ABB India, a prominent player in the capital goods industry, rose over 305 so far in 2023 to hit a fresh record high in May 2023 but the rally may not be over yet, suggest experts.Short-term traders can look to buy the stock now or on dips for a possible target of Rs 3,900 in 2-4 months, they say.The stock rose from Rs 2,683 recorded on December 30, 2022, to Rs 3,655, which is the record high registered on May 4 in intraday trade.",https://news.google.com/rss/articles/CBMirQFodHRwczovL20uZWNvbm9taWN0aW1lcy5jb20vbWFya2V0cy9zdG9ja3MvbmV3cy9zdG9jay1yYWRhci1vdmVyLTMwLXJhbGx5LWluLTIwMjMtdGhpcy1jYXBpdGFsLWdvb2RzLXN0b2NrLWhpdC1mcmVzaC1yZWNvcmQtaGlnaHMtaW4tbWF5LXRpbWUtdG8tYnV5L2FydGljbGVzaG93Lzk5OTkwOTEzLmNtc9IBsQFodHRwczovL20uZWNvbm9taWN0aW1lcy5jb20vbWFya2V0cy9zdG9ja3MvbmV3cy9zdG9jay1yYWRhci1vdmVyLTMwLXJhbGx5LWluLTIwMjMtdGhpcy1jYXBpdGFsLWdvb2RzLXN0b2NrLWhpdC1mcmVzaC1yZWNvcmQtaGlnaHMtaW4tbWF5LXRpbWUtdG8tYnV5L2FtcF9hcnRpY2xlc2hvdy85OTk5MDkxMy5jbXM?oc=5
Stock Radar: Nearly 30% in a month! EIL hits a fresh 52-week high; time to book profit?,"Mon, 22 May 2023 23:30:00 GMT","Engineers India (EIL), a part of the civil construction space, rose by about 30% in a month, driving the stock price to a fresh 52-week high in May, but chart patterns suggest that the rally may not be over yet.Short-term traders can buy the stock now or on dips for a target of Rs 120 in 3-4 months, suggest experts.The stock rose from Rs 78.10 recorded on 19th April 2023 to Rs 100.45 as on 19 May 2023, which translates into an upside of 29% in a",https://news.google.com/rss/articles/CBMirQFodHRwczovL2Vjb25vbWljdGltZXMuaW5kaWF0aW1lcy5jb20vbWFya2V0cy9zdG9ja3MvbmV3cy9zdG9jay1yYWRhci1uZWFybHktMzAtaW4tYS1tb250aC1laWwtaGl0cy1hLWZyZXNoLTUyLXdlZWstaGlnaC10aW1lLXRvLWJvb2stcHJvZml0cy1vci1idXkvYXJ0aWNsZXNob3cvMTAwNDI0MTU3LmNtc9IBqAFodHRwczovL20uZWNvbm9taWN0aW1lcy5jb20vbWFya2V0cy9zdG9ja3MvbmV3cy9zdG9jay1yYWRhci1uZWFybHktMzAtaW4tYS1tb250aC1laWwtaGl0cy1hLWZyZXNoLTUyLXdlZWstaGlnaC10aW1lLXRvLWJvb2stcHJvZml0cy1vci1idXkvYW1wX2FydGljbGVzaG93LzEwMDQyNDE1Ny5jbXM?oc=5
Sensex today: Stock Market Highlights: RIL may trigger next leg of rally in Nifty. What should traders do on Wednesday,"Tue, 09 May 2023 07:00:00 GMT",,https://news.google.com/rss/articles/CBMikQFodHRwczovL2Vjb25vbWljdGltZXMuaW5kaWF0aW1lcy5jb20vbWFya2V0cy9zdG9ja3MvbGl2ZS1ibG9nL2JzZS1zZW5zZXgtdG9kYXktbGl2ZS1uaWZ0eS1zdG9jay1tYXJrZXQtdXBkYXRlcy0wOS1tYXktMjAyMy9saXZlYmxvZy8xMDAwODYyNjEuY21z0gGVAWh0dHBzOi8vZWNvbm9taWN0aW1lcy5pbmRpYXRpbWVzLmNvbS9tYXJrZXRzL3N0b2Nrcy9saXZlLWJsb2cvYnNlLXNlbnNleC10b2RheS1saXZlLW5pZnR5LXN0b2NrLW1hcmtldC11cGRhdGVzLTA5LW1heS0yMDIzL2FtcF9saXZlYmxvZy8xMDAwODYyNjEuY21z?oc=5
Ashish Kacholia stock: Gravita India shares hit all-time high today; here’s why,"Wed, 03 May 2023 07:00:00 GMT","Shares of Gravita India hit a fresh all-time high today after the firm’s step down subsidiary Gravita Netherlands BV was provided 34 million Euros ESG loan from European Developmental Financial Institutions.
Shares of Gravita India are trading higher than the 5 day, 20 day, 50 day, 100 day and 200 day moving averages.
The facility is guaranteed by the parent Gravita India Limited, it added.
Ace investor Ashish Kacholia holds stake in Gravita India.
Gravita India is one of the largest lead recyclers in India with a market share of 18-19 per cent in the organised lead recycling market.",https://news.google.com/rss/articles/CBMilwFodHRwczovL3d3dy5idXNpbmVzc3RvZGF5LmluL21hcmtldHMvY29tcGFueS1zdG9jay9zdG9yeS9hc2hpc2gta2FjaG9saWEtc3RvY2stZ3Jhdml0YS1pbmRpYS1zaGFyZXMtaGl0LWFsbC10aW1lLWhpZ2gtdG9kYXktaGVyZXMtd2h5LTM3OTg4My0yMDIzLTA1LTAz0gGbAWh0dHBzOi8vd3d3LmJ1c2luZXNzdG9kYXkuaW4vYW1wL21hcmtldHMvY29tcGFueS1zdG9jay9zdG9yeS9hc2hpc2gta2FjaG9saWEtc3RvY2stZ3Jhdml0YS1pbmRpYS1zaGFyZXMtaGl0LWFsbC10aW1lLWhpZ2gtdG9kYXktaGVyZXMtd2h5LTM3OTg4My0yMDIzLTA1LTAz?oc=5
Coal India’s stock remains attractive despite decline in Q4 profits,"Tue, 09 May 2023 07:00:00 GMT","The company’s revenue from operations increased by 16.5 per cent year-on-year to ₹38,152.3 crore, which was 8.17 per cent higher than the consensus estimates.
PerformanceThe company produced nearly 224.16 million tonnes (mt) of coal during the quarter, up 7.25 per cent y-o-y, while its offtake rose by 3.68 per cent to 186.87 mt.
The sales from offtake through fuel supply arrangements (FSA) increased by about 17 per cent because of 11 per cent higher volume offtake and five per cent higher realisation.
Though the base price hike was not there, a better volume mix has led to higher FSA realisation per tonne.
85 per cent up y-o-y, on account of which sales through e-auction rose by 10 per cent despite around 41 per cent fall in volumes.",https://news.google.com/rss/articles/CBMiygFodHRwczovL3d3dy50aGVoaW5kdWJ1c2luZXNzbGluZS5jb20vcG9ydGZvbGlvL3N0b2NrLWZ1bmRhbWVudGFsLWFuYWx5c2lzLWluZGlhL2NvYWwtaW5kaWEtaGlnaGVyLW91dHB1dC1yZXZlbnVlLWdyb3d0aC1vZmZzZXQtb25lLXRpbWUtZXhwZW5zZS1zdG9jay1yZW1haW5zLWF0dHJhY3RpdmUtZm9yLWludmVzdG9ycy9hcnRpY2xlNjY4MjgyNDkuZWNl0gHPAWh0dHBzOi8vd3d3LnRoZWhpbmR1YnVzaW5lc3NsaW5lLmNvbS9wb3J0Zm9saW8vc3RvY2stZnVuZGFtZW50YWwtYW5hbHlzaXMtaW5kaWEvY29hbC1pbmRpYS1oaWdoZXItb3V0cHV0LXJldmVudWUtZ3Jvd3RoLW9mZnNldC1vbmUtdGltZS1leHBlbnNlLXN0b2NrLXJlbWFpbnMtYXR0cmFjdGl2ZS1mb3ItaW52ZXN0b3JzL2FydGljbGU2NjgyODI0OS5lY2UvYW1wLw?oc=5
"Stocks to Watch: Coal India, BPCL, Adani Power, Glenmark Pharma, Zee","Tue, 23 May 2023 01:52:39 GMT","BPCL: Bharat Petroleum Corporation Ltd (BPCL) has reported a 159% surge in its standalone net profit for the March ended quarter at ₹6,478 crore.
Sequentially, net profit zoomed 230% from ₹1,960 crore during October to December.
Glenmark Pharma which holds an 82.85% stake in Glenmark Life is looking to reduce its debt via stake sale.
Shree Cement: Has reported a consolidated net profit of ₹525.77 crore in the March quarter, down 20% from ₹657.24 crore a year ago.
On a sequential basis, however, net profit surged 86.4% over the previous quarter’s ₹282.07 crore.",https://news.google.com/rss/articles/CBMihQFodHRwczovL3d3dy5saXZlbWludC5jb20vbWFya2V0L3N0b2NrLW1hcmtldC1uZXdzL3N0b2Nrcy10by13YXRjaC1jb2FsLWluZGlhLWJwY2wtYWRhbmktcG93ZXItZ2xlbm1hcmstcGhhcm1hLXplZS0xMTY4NDgwMzY2NjA0Ni5odG1s0gGJAWh0dHBzOi8vd3d3LmxpdmVtaW50LmNvbS9tYXJrZXQvc3RvY2stbWFya2V0LW5ld3Mvc3RvY2tzLXRvLXdhdGNoLWNvYWwtaW5kaWEtYnBjbC1hZGFuaS1wb3dlci1nbGVubWFyay1waGFybWEtemVlL2FtcC0xMTY4NDgwMzY2NjA0Ni5odG1s?oc=5
Pharma firm Granules India hit by IT security breach; stock tanks 2%,"Thu, 25 May 2023 07:13:00 GMT","Shares of Granules India tumbled 2 percent in Thursday's trade.
At 12:33 pm, the script was trading 1.94 percent lower at Rs 273.50 apiece on the BSEHyderabad-based pharmaceutical company Granules India on Thursday informed the stock exchanges about an information technology security breac h. The stock of Granules India tumbled 2 percent in Thursday's trade.
At 12:33 pm, the script was trading 1.94 percent lower at Rs 273.50 apiece on the BSE.
Live TvLoading...
The company said that it was investigating the matter and actions were being taken to address the incident.",https://news.google.com/rss/articles/CBMieGh0dHBzOi8vd3d3LmNuYmN0djE4LmNvbS9idXNpbmVzcy9ncmFudWxlcy1pbmRpYS1pdC1zZWN1cml0eS1icmVhY2gtcmFuc29td2FyZS1hdHRhY2stc2hhcmVzLXRhbmstMi1wZXJjZW50LTE2NzU5NzQxLmh0bdIBfGh0dHBzOi8vd3d3LmNuYmN0djE4LmNvbS9idXNpbmVzcy9ncmFudWxlcy1pbmRpYS1pdC1zZWN1cml0eS1icmVhY2gtcmFuc29td2FyZS1hdHRhY2stc2hhcmVzLXRhbmstMi1wZXJjZW50LTE2NzU5NzQxLmh0bS9hbXA?oc=5
Sun Pharma share price: Key triggers for future performance in this pharma stock after Q4 results; should you buy?,"Sat, 27 May 2023 15:54:58 GMT","Leading generics/specialty pharma company, Sun Pharma posted a mixed performance in Q4FY23 with revenue coming in line with expectations, however, the EBITDA margin was a miss.
Brokerage ICICI Direct has recommended buying Sun Pharma stock after the Q4 numbers.
On Friday, Sun Pharma's stock reacted positively to the earnings and ended at ₹970.65 apiece up by 2.75% on BSE.
On Friday, Sun Pharma also announced a final dividend of ₹4 per share for FY23.
As per the brokerage's note, Sun Pharma’s share price has grown at a CAGR of 28.15% over the past three years.",https://news.google.com/rss/articles/CBMikwFodHRwczovL3d3dy5saXZlbWludC5jb20vbWFya2V0L3N0b2NrLW1hcmtldC1uZXdzL3N1bi1waGFybWEtcTQtcmVzdWx0cy1zaG91bGQtaW52ZXN0b3JzLWJ1eS1zdW4tcGhhcm1hLXNoYXJlcy1hZnRlci1xNC1udW1iZXJzLTExNjg1MjAwMDY2MjY2Lmh0bWzSAZcBaHR0cHM6Ly93d3cubGl2ZW1pbnQuY29tL21hcmtldC9zdG9jay1tYXJrZXQtbmV3cy9zdW4tcGhhcm1hLXE0LXJlc3VsdHMtc2hvdWxkLWludmVzdG9ycy1idXktc3VuLXBoYXJtYS1zaGFyZXMtYWZ0ZXItcTQtbnVtYmVycy9hbXAtMTE2ODUyMDAwNjYyNjYuaHRtbA?oc=5
India likely to see listing of four REITs in next 18 months: Property stalwart Anshuman Magazine,"Fri, 26 May 2023 05:36:00 GMT","India exempted investments by non-resident entities such as sovereign wealth funds and pension funds from 21 countries from the so-called ‘angel tax’, leaving out Mauritius, Singapore, and UAE among others that account for significant equity inflow into the country.
Experience Your Economic Times Newspaper, The Digital Way!
Friday, 26 May, 2023(What's moving Sensex and Nifty Track latest market news stock tips and expert advice on ETMarkets .
For fastest news alerts on financial markets, investment strategies and stocks alerts, subscribe to our Telegram feeds .)
Download The Economic Times News App to get Daily Market Updates & Live Business News.",https://news.google.com/rss/articles/CBMisgFodHRwczovL2Vjb25vbWljdGltZXMuaW5kaWF0aW1lcy5jb20vbWFya2V0cy9zdG9ja3MvbmV3cy9pbmRpYS1saWtlbHktdG8tc2VlLWxpc3Rpbmctb2YtZm91ci1yZWl0cy1pbi1uZXh0LTE4LW1vbnRocy1wcm9wZXJ0eS1zdGFsd2FydC1hbnNodW1hbi1tYWdhemluZS9hcnRpY2xlc2hvdy8xMDA1MTk1MjQuY21z0gGtAWh0dHBzOi8vbS5lY29ub21pY3RpbWVzLmNvbS9tYXJrZXRzL3N0b2Nrcy9uZXdzL2luZGlhLWxpa2VseS10by1zZWUtbGlzdGluZy1vZi1mb3VyLXJlaXRzLWluLW5leHQtMTgtbW9udGhzLXByb3BlcnR5LXN0YWx3YXJ0LWFuc2h1bWFuLW1hZ2F6aW5lL2FtcF9hcnRpY2xlc2hvdy8xMDA1MTk1MjQuY21z?oc=5
"FII flows, global events among top 10 factors to dictate Dalal Street mood this week","Sun, 28 May 2023 05:00:00 GMT","Indian markets began the June series on a positive note, with both frontline indices S&P BSE Sensex and Nifty50 ending Friday with strong gains.
Nasdaq Composite finished 2.19% higher at 12,975.70.When Indian markets reopen on Monday, they will take cues from the Friday closing of the US markets.
Torrent Power will consider raising funds by issuance of NCDs up to Rs 3,000 crore on the same day.
June natural gas fell 13 cents to $2.18 per 1,000 cubic feet.On MCX, April Crude Oil futures ended at Rs 6008, up by Rs 62 or 1.04%.
Rupee strength can be seen towards 82.50 in the next few sessions,"" Trivedi said.MCX June Gold futures ended at Rs 59,372, down 0.15%.",https://news.google.com/rss/articles/CBMinQFodHRwczovL20uZWNvbm9taWN0aW1lcy5jb20vbWFya2V0cy9zdG9ja3MvbmV3cy9maWktZmxvd3MtZ2xvYmFsLWV2ZW50cy1hbW9uZy10b3AtMTAtZmFjdG9ycy10by1kaWN0YXRlLWRhbGFsLXN0cmVldC1tb29kLXRoaXMtd2Vlay9hcnRpY2xlc2hvdy8xMDA1NjMyMDguY21z0gGhAWh0dHBzOi8vbS5lY29ub21pY3RpbWVzLmNvbS9tYXJrZXRzL3N0b2Nrcy9uZXdzL2ZpaS1mbG93cy1nbG9iYWwtZXZlbnRzLWFtb25nLXRvcC0xMC1mYWN0b3JzLXRvLWRpY3RhdGUtZGFsYWwtc3RyZWV0LW1vb2QtdGhpcy13ZWVrL2FtcF9hcnRpY2xlc2hvdy8xMDA1NjMyMDguY21z?oc=5
Havells India Share Price: Share price of Havells India falls as Nifty strengthens,"Tue, 09 May 2023 07:00:00 GMT","slipped 0.19 per cent to Rs 1255.55 in Tuesday's trade as of 12:16PM (IST).
The stock hit a high price of Rs 1267.7 and low of Rs 1253.2 during the session.The return on equity (ROE) for the stock stood at 16.17 per cent.
Traded volume on the counter stood at 12:16PM shares and turnover at Rs 1.55 crore around that time.
A nine-day exponential moving average, called the signal line, is plotted on topof the MACD to reflect ""buy"" or ""sell"" opportunities.
When the MACD crosses below the signal line, it gives a bearish signal, indicating that the price of the security may see a downward movement and vice versa.",https://news.google.com/rss/articles/CBMikQFodHRwczovL2Vjb25vbWljdGltZXMuaW5kaWF0aW1lcy5jb20vbWFya2V0cy9zdG9ja3Mvc3RvY2std2F0Y2gvc2hhcmUtcHJpY2Utb2YtaGF2ZWxscy1pbmRpYS1mYWxscy1hcy1uaWZ0eS1zdHJlbmd0aGVucy9hcnRpY2xlc2hvdy8xMDAwOTM0MDYuY21z0gGMAWh0dHBzOi8vbS5lY29ub21pY3RpbWVzLmNvbS9tYXJrZXRzL3N0b2Nrcy9zdG9jay13YXRjaC9zaGFyZS1wcmljZS1vZi1oYXZlbGxzLWluZGlhLWZhbGxzLWFzLW5pZnR5LXN0cmVuZ3RoZW5zL2FtcF9hcnRpY2xlc2hvdy8xMDAwOTM0MDYuY21z?oc=5
Zomato Steals The Spotlight As New-Age Tech Stocks Rally This Week,"Sun, 28 May 2023 05:01:36 GMT","Nine out of the 14 new-age tech stocks under Inc42’s coverage gained this week, rising in the range of 1% to over 4%.
Despite the bullish trend, some of the new-age tech stocks ended the week in the red.
IndiaMart InterMESH (down 0.5%), Paytm (down 0.6%), Nykaa (down 1.6%), PB Fintech (down 4%) were the other losers.
The 14 new-age tech stocks under Inc42’s coverage ended the week with a total market capitalisation of $29.1 Bn versus $28.94 Bn last week.
PB Fintech shares slumped almost 3% on Friday alone after Tencent dumped 2.1% stake in the company.",https://news.google.com/rss/articles/CBMiWmh0dHBzOi8vaW5jNDIuY29tL2J1enovem9tYXRvLXN0ZWFscy10aGUtc3BvdGxpZ2h0LWFzLW5ldy1hZ2UtdGVjaC1zdG9ja3MtcmFsbHktdGhpcy13ZWVrL9IBXmh0dHBzOi8vaW5jNDIuY29tL2J1enovem9tYXRvLXN0ZWFscy10aGUtc3BvdGxpZ2h0LWFzLW5ldy1hZ2UtdGVjaC1zdG9ja3MtcmFsbHktdGhpcy13ZWVrL2FtcC8?oc=5
5 High Return Smallcap Stocks to Add to Your Watchlist,"Fri, 26 May 2023 06:00:32 GMT","The smallcap segment of the stock market is well-known for its potential to deliver substantial returns.
Investors seeking growth opportunities usually turn to small-cap stocks.
Small-cap stocks have the potential for significant growth, but not every smallcap becomes a giant.
Here’s a close look at the top small-cap stocks that have generated high returns in the past.
Snapshot of Small-cap Stocks on Equitymaster's Indian Stock ScreenerHere's a quick view of the above companies based on their financials.",https://news.google.com/rss/articles/CBMifGh0dHBzOi8vd3d3LmxpdmVtaW50LmNvbS9tYXJrZXQvc3RvY2stbWFya2V0LW5ld3MvNS1oaWdoLXJldHVybi1zbWFsbGNhcC1zdG9ja3MtdG8tYWRkLXRvLXlvdXItd2F0Y2hsaXN0LTExNjg1MDc5ODkzMzgxLmh0bWzSAYABaHR0cHM6Ly93d3cubGl2ZW1pbnQuY29tL21hcmtldC9zdG9jay1tYXJrZXQtbmV3cy81LWhpZ2gtcmV0dXJuLXNtYWxsY2FwLXN0b2Nrcy10by1hZGQtdG8teW91ci13YXRjaGxpc3QvYW1wLTExNjg1MDc5ODkzMzgxLmh0bWw?oc=5
How technology is changing the trading landscape,"Mon, 01 May 2023 07:00:00 GMT","The evolution of stock market trading in India started below a Banyan tree in Mumbai in 1855 by a few people which then moved on to Ring base trading in the BSE building.
Then came the 1990’s which transformed trading from a traditional open floor trading system to a sophisticated electronic screen-based trading system commonly known as BOLT on BSE and NEAT on NSE.
20% of the total exchange trading volumes came from Mobile trading.
The emergence of numerous Fintech startups has led to a paradigm shift in the stock market world.
The future belongs to Voice command-based trading, Bot Trading, and the predominant use of AI in taking logical investment decisions.",https://news.google.com/rss/articles/CBMiggFodHRwczovL2Vjb25vbWljdGltZXMuaW5kaWF0aW1lcy5jb20vbWFya2V0cy9zdG9ja3MvbmV3cy9ob3ctdGVjaG5vbG9neS1pcy1jaGFuZ2luZy10aGUtdHJhZGluZy1sYW5kc2NhcGUvYXJ0aWNsZXNob3cvOTk5MDQ4NzAuY21z0gF9aHR0cHM6Ly9tLmVjb25vbWljdGltZXMuY29tL21hcmtldHMvc3RvY2tzL25ld3MvaG93LXRlY2hub2xvZ3ktaXMtY2hhbmdpbmctdGhlLXRyYWRpbmctbGFuZHNjYXBlL2FtcF9hcnRpY2xlc2hvdy85OTkwNDg3MC5jbXM?oc=5
"Multibagger smallcap stock announces 2:5 bonus issue, Rs 6 dividend","Fri, 26 May 2023 09:46:00 GMT","The board of Aptech approved an interim dividend and bonus issue of equity shares to investors.
The company declared an interim dividend of Rs 6 per share for the financial year 2023.The said dividend payment is subject to the approval of shareholders in the annual general meeting.
When a company goes ex-dividend on a particular date, its stock does not carry the value of the next dividend payment.Apart from the dividend, the company's board has also approved a bonus issue of equity shares in the proportion of 2:5.
For every five equity shares investors hold, they will get additional two bonus shares as proposed by the company.
When a firm issues bonus shares, its shareholders do not have to incur any extra costs to get them.",https://news.google.com/rss/articles/CBMilAFodHRwczovL2Vjb25vbWljdGltZXMuaW5kaWF0aW1lcy5jb20vbWFya2V0cy9zdG9ja3MvbmV3cy9tdWx0aWJhZ2dlci1zbWFsbGNhcC1zdG9jay1hbm5vdW5jZXMtMjUtYm9udXMtaXNzdWUtcnMtNi1kaXZpZGVuZC9hcnRpY2xlc2hvdy8xMDA1MjYyNzkuY21z0gGPAWh0dHBzOi8vbS5lY29ub21pY3RpbWVzLmNvbS9tYXJrZXRzL3N0b2Nrcy9uZXdzL211bHRpYmFnZ2VyLXNtYWxsY2FwLXN0b2NrLWFubm91bmNlcy0yNS1ib251cy1pc3N1ZS1ycy02LWRpdmlkZW5kL2FtcF9hcnRpY2xlc2hvdy8xMDA1MjYyNzkuY21z?oc=5
Burger King India operator's shares zoom 20% to hit upper circuit; here's why,"Thu, 18 May 2023 07:00:00 GMT","Shares of Restaurant Brands Asia, operator of Burger King India, rose sharply in Thursday's trade despite a weak quarterly show.
The stock today soared 20 per cent to hit its upper price band of Rs 128.45 over a previous close of Rs 107.05.
As of March 31, 2022, Everstone Capital held a 40.90 per cent stake in Restaurant Brands through its investment vehicle QSR Asia Pte Ltd.
The company's consolidated net loss widened to Rs 73.37 crore in the quarter that ended March 31, 2023, from Rs 67.07 crore a year earlier.
""Restaurant Brands was very aggressive with its expansion plans.",https://news.google.com/rss/articles/CBMilAFodHRwczovL3d3dy5idXNpbmVzc3RvZGF5LmluL21hcmtldHMvY29tcGFueS1zdG9jay9zdG9yeS9idXJnZXIta2luZy1pbmRpYS1vcGVyYXRvcnMtc2hhcmVzLXpvb20tMjAtdG8taGl0LXVwcGVyLWNpcmN1aXQtaGVyZXMtd2h5LTM4MTgzNy0yMDIzLTA1LTE40gGYAWh0dHBzOi8vd3d3LmJ1c2luZXNzdG9kYXkuaW4vYW1wL21hcmtldHMvY29tcGFueS1zdG9jay9zdG9yeS9idXJnZXIta2luZy1pbmRpYS1vcGVyYXRvcnMtc2hhcmVzLXpvb20tMjAtdG8taGl0LXVwcGVyLWNpcmN1aXQtaGVyZXMtd2h5LTM4MTgzNy0yMDIzLTA1LTE4?oc=5
"Adani Power, Marico, Paytm, Coal India among stocks to watch out for today","Mon, 08 May 2023 07:00:00 GMT","The consolidated total revenue for Q4 FY23 was Rs 10,795 crore as compared to Rs 13,308 crore in Q4 FY 2021-22.
Net profit climbed 18.67% to Rs 305 crore in the January-March quarter compared to Rs 257 crore profit in the corresponding period a year ago.
In the December quarter, profit stood at Rs 333 crore, implying a fall of 8.40% on a quarter on quarter basis.
This was on a 39% rise in consolidated revenue for Q4FY23 at Rs 376 crore from Rs 271 crore in Q4FY22.
Income rose to Rs 1429 crore in Q4 FY23 from Rs 1,255 crore in the same quarter last year.",https://news.google.com/rss/articles/CBMikgFodHRwczovL3d3dy5idXNpbmVzc3RvZGF5LmluL21hcmtldHMvY29tcGFueS1zdG9jay9zdG9yeS9hZGFuaS1wb3dlci1tYXJpY28tcGF5dG0tY29hbC1pbmRpYS1hbW9uZy1zdG9ja3MtdG8td2F0Y2gtb3V0LWZvci10b2RheS0zODAzODItMjAyMy0wNS0wONIBlgFodHRwczovL3d3dy5idXNpbmVzc3RvZGF5LmluL2FtcC9tYXJrZXRzL2NvbXBhbnktc3RvY2svc3RvcnkvYWRhbmktcG93ZXItbWFyaWNvLXBheXRtLWNvYWwtaW5kaWEtYW1vbmctc3RvY2tzLXRvLXdhdGNoLW91dC1mb3ItdG9kYXktMzgwMzgyLTIwMjMtMDUtMDg?oc=5
Havells India Share Price: Shares of Havells India fall as Nifty gains,"Mon, 08 May 2023 07:00:00 GMT","slipped 1.95 per cent to Rs 1260.0 in Monday's trade as of 01:39PM (IST).
It hit a high of Rs 1297.4 and low of Rs 1257.75 during the session.The stock quoted a 52-week high price of Rs 1405.85 and a low of Rs 1058.7.
The return on equity for the stock stood at 16.17 per cent.
If a stock trades well above 50-DMA and 200-DMA, it usually means the immediate trend is upward.
Mutual funds and foreign institutional investors held 3.91 per cent and 23.11 per cent stake.",https://news.google.com/rss/articles/CBMifGh0dHBzOi8vbS5lY29ub21pY3RpbWVzLmNvbS9tYXJrZXRzL3N0b2Nrcy9zdG9jay13YXRjaC9zaGFyZXMtb2YtaGF2ZWxscy1pbmRpYS1mYWxsLWFzLW5pZnR5LWdhaW5zL2FydGljbGVzaG93LzEwMDA2OTM2MC5jbXPSAYABaHR0cHM6Ly9tLmVjb25vbWljdGltZXMuY29tL21hcmtldHMvc3RvY2tzL3N0b2NrLXdhdGNoL3NoYXJlcy1vZi1oYXZlbGxzLWluZGlhLWZhbGwtYXMtbmlmdHktZ2FpbnMvYW1wX2FydGljbGVzaG93LzEwMDA2OTM2MC5jbXM?oc=5
Havells India Share Price: Havells India share price up 1.03 per cent,"Fri, 12 May 2023 07:00:00 GMT","traded 1.03 per cent up at Rs 1295.25 at around 10:05AM (IST) on Friday.
The company reported net profit of Rs 358.04 crore for the latest quarter.The MACD signalled a bullish bias on the counter.
The MACD is known for signalling trend reversals in traded securities or indices.
A nine-day exponential moving average, called the signal line, is plotted on top of the MACD to reflect ""buy"" or ""sell"" opportunities.
When the MACD crosses below the signal line, it gives a bearish signal, indicating that the price of the security may see a downward movement and vice versa.",https://news.google.com/rss/articles/CBMie2h0dHBzOi8vbS5lY29ub21pY3RpbWVzLmNvbS9tYXJrZXRzL3N0b2Nrcy9zdG9jay13YXRjaC9oYXZlbGxzLWluZGlhLXNoYXJlLXByaWNlLXVwLTEtMDMtcGVyLWNlbnQvYXJ0aWNsZXNob3cvMTAwMTc1NTM5LmNtc9IBf2h0dHBzOi8vbS5lY29ub21pY3RpbWVzLmNvbS9tYXJrZXRzL3N0b2Nrcy9zdG9jay13YXRjaC9oYXZlbGxzLWluZGlhLXNoYXJlLXByaWNlLXVwLTEtMDMtcGVyLWNlbnQvYW1wX2FydGljbGVzaG93LzEwMDE3NTUzOS5jbXM?oc=5
Shipping Corporation of India shares jumped 8.7% to hit an intraday high of ₹102.83 apiece on the BSE.,"Wed, 10 May 2023 07:00:00 GMT","Shares of Shipping Corporation of India rallied over 8% Wednesday led by strong financial performance in the quarter ended March 2023.
The stock jumped 8.7% to hit an intraday high of ₹102.83 apiece on the BSE.
In the last one month, Shipping Corporation of India stock price jumped more than 23%.
The share price hit a 52-week low of ₹79.50 on April 10, 2023, and has recouped some losses since then.
At 12pm, Shipping Corporation of India shares were trading 5.87% higher at ₹100.08 on the BSE.",https://news.google.com/rss/articles/CBMijgFodHRwczovL3d3dy5saXZlbWludC5jb20vbWFya2V0L3N0b2NrLW1hcmtldC1uZXdzL3NjaS1xNC1yZXN1bHRzLXNoaXBwaW5nLWNvcnBvcmF0aW9uLW9mLWluZGlhLXNoYXJlcy1yYWxseS04LW9uLXN0cm9uZy1xNC0xMTY4MzcwMDQ4NDkxMS5odG1s0gGSAWh0dHBzOi8vd3d3LmxpdmVtaW50LmNvbS9tYXJrZXQvc3RvY2stbWFya2V0LW5ld3Mvc2NpLXE0LXJlc3VsdHMtc2hpcHBpbmctY29ycG9yYXRpb24tb2YtaW5kaWEtc2hhcmVzLXJhbGx5LTgtb24tc3Ryb25nLXE0L2FtcC0xMTY4MzcwMDQ4NDkxMS5odG1s?oc=5
"Can Maruti Suzuki India shares drive past Rs 10,000 mark? Here's what brokerages say","Mon, 01 May 2023 07:00:00 GMT","Hybrid variants of the new Grand Vitara contributed to around 35-40 per cent of the total demand, a brokerage said.
Brokerage view on Maruti:At least five brokerages have given a 'Buy' call on the counter suggesting a Rs 10,000-plus target price over a 12-month period.
We have a revised target price of Rs 10,300 (Rs 10,600 earlier) at 26x Mar-25E EPS.""
The brokerage has recommended an 'Outperform' rating on the counter with a target price of Rs 10,331 over the next 12 months.
YES Securities has assigned an 'Add' rating on the stock with a revised target price of Rs 10,051 (Rs 10,605 earlier).",https://news.google.com/rss/articles/CBMinAFodHRwczovL3d3dy5idXNpbmVzc3RvZGF5LmluL21hcmtldHMvY29tcGFueS1zdG9jay9zdG9yeS9jYW4tbWFydXRpLXN1enVraS1pbmRpYS1zaGFyZXMtZHJpdmUtcGFzdC1ycy0xMDAwMC1tYXJrLWhlcmVzLXdoYXQtYnJva2VyYWdlcy1zYXktMzc5NTI0LTIwMjMtMDUtMDHSAaABaHR0cHM6Ly93d3cuYnVzaW5lc3N0b2RheS5pbi9hbXAvbWFya2V0cy9jb21wYW55LXN0b2NrL3N0b3J5L2Nhbi1tYXJ1dGktc3V6dWtpLWluZGlhLXNoYXJlcy1kcml2ZS1wYXN0LXJzLTEwMDAwLW1hcmstaGVyZXMtd2hhdC1icm9rZXJhZ2VzLXNheS0zNzk1MjQtMjAyMy0wNS0wMQ?oc=5
